{
	"name": "{{ i18n('name') }}",
	"description": "{{ i18n('description') }}",
	"version": "0.0.1",
	"suffix": "",
	"flat": false,
	"indent": "{{defaultConf.indent}}",
	"user": "{{defaultConf.user}}",
	"placeHolder": "{{i18n('templateSelectPlaceHolder')}}",
	"showHidden": false,
	"targets": [{
		"filepath": "{{ path.resolve(projectFolder, inputs.srcPath, inputs.filename + ( suffix ?  '.' + suffix : ''))}}",
		"tplpath": "tpl"
	}],
	"inputs": [
		{
			"type": "path",
			"name": "srcPath",
			"prompt": "{{i18n('inputs.srcPath.prompt')}}",
			"placeHolder": "{{i18n('inputs.srcPath.placeHolder')}}",
			"value": "{{helper.activeDirectoryRelativeBasePath(projectFolder)}}",
			"suggest": {
				"value": "src"
			}
		},
		{
			"type": "text",
			"name": "filename",
			"prompt": "{{i18n('inputs.filename.prompt')}}",
			"placeHolder": "{{i18n('inputs.filename.placeHolder')}}",
			"suggest": {
				"selected": true,
				"value": "main"
			}
		}
	],
	"comment": {
		"copyright": "Copyright (c) {{year}}, {{user}}. All rights reserved.",
		"dateFormat": "YYYY-MM-DD",
		"startLine": "/**",
		"lineHeader": " * ",
		"endLine": " */",
		"items": [
			"{{comment.copyright}}",
			"",
			"@author {{user}}",
			"@date {{date}}",
			"@version {{version}}"
		]
	},
	"match": {
		"always": true
	}
}