{
	"name": "{{ i18n('class') }}",
	"description": "{{ i18n('class.description') }}",
	"suffix": "java",
	"weight": 100,
	"targets": [
		{
			"filepath": "{{ customize['fullTargetPath'] }}",
			"tplpath": "tpl"
		}
	],
	"inputs": [
		{
			"type": "path",
			"name": "srcPath",
			"after": "{{customize['fullSrcPath'] = path.resolve(projectFolder, inputs.srcPath)}}",
			"checkRules": "{{[checkRules.activeDirectoryRuleFunction(projectFolder)]}}",
			"suggest": {
				"value": "{{ helper.flatAndFilterSuggestPath(projectFolder, helper.descendant(projectFolder, 4) ,['src/main/java', 'src/test/java', 'src'])}}"
			}
		},
		{
			"type": "path",
			"name": "packageName",
			"checkRules": "{{checkRules.packageName}}",
			"value": "{{helper.activeDirectoryRelativeBasePath(customize['fullSrcPath'], '.') }}",
			"after": "{{customize['fullFileDirPath'] = path.resolve(customize['fullSrcPath'],  path.join(...inputs.packageName.split('.')))}}",
			"suggest": {
				"selected": false,
				"value": "{{[...helper.openedFileDirectoryPath(customize['fullSrcPath'], '.'), helper.firstHasManyChildrenDirectory(customize['fullSrcPath'], '.')].filter(v=>v) }}"
			},
			"option": {
				"pathSeparator": ".",
				"basePath": "{{customize['fullSrcPath']}}"
			}
		},
		{
			"type": "text",
			"name": "className",
			"after": "{{customize['fullTargetPath'] = path.resolve(customize['fullFileDirPath'], inputs.className + '.' + suffix)}}",
			"checkRules": "{{[checkRules.notEmpty, checkRules.commonIdentifier, checkRules.uppercaseFirst]}}",
			"suggest": {
				"selected": true,
				"value": "Main"
			}
		}
	],
	"comment": {
		"dateFormat": "YYYY-MM-DD",
		"startLine": "/**",
		"lineHeader": " * ",
		"endLine": " */",
		"items": [
			"{{comment.copyright}}",
			"",
			"@author {{user}}",
			"@date {{date}}",
			"@version {{version}}"
		]
	}
}